eng_Latn,guj_Gujr
"""""""I have young actors and actresses that I mentor, I have nieces and nephews that I am very close to,"""" she trills.""
","""મારી પાસે યુવાન કલાકારો અને અભિનેત્રી છે, જેમના માર્ગદર્શક હું છું, અને ભત્રીજાઓ જેમના માટે હું એક નજીકના વ્યક્તિ બન્યા """"""
"
"""March 20, 1693 (then 1692): Abigail Faulkner Sr., whose execution was only delayed because she was pregnant, and whose sister, sister-in-law, two daughters, two nieces and a nephew had been among those accused of witchcraft, gave birth to a son she named Ammi Ruhamah, meaning """"my people have obtained mercy.""""""
","""માર્ચ 20, 1693 (ત્યારબાદ 1692): એબીગેઇલ ફોકનર સિરિયા , જેનું મૃત્યુદંડ માત્ર વિલંબિત હતું કારણ કે તે ગર્ભવતી હતી, અને જેની બહેન, ભાભી, બે દીકરીઓ, બે ભત્રીજાઓ અને મેલીવિચિંગના આરોપ વચ્ચે હતા, તેણે અમી રુહમા નામના દીકરાને જન્મ આપ્યો, જેનો અર્થ """"મારા લોકોએ દયા મેળવી છે.""
"
"""March 20, 1693 (then 1692): Abigail Faulkner Sr., whose execution was only delayed because she was pregnant, and whose sister, sister-in-law, two daughters, two nieces, and a nephew had been among those accused of witchcraft, gave birth to a son she named Ammi Ruhamah, meaning """"my people have obtained mercy.""""""
","""માર્ચ 20, 1693 (ત્યારબાદ 1692): એબીગેઇલ ફોકનર સિરિયા , જેનું મૃત્યુદંડ માત્ર વિલંબિત હતું કારણ કે તે ગર્ભવતી હતી, અને જેની બહેન, ભાભી, બે દીકરીઓ, બે ભત્રીજાઓ અને મેલીવિચિંગના આરોપ વચ્ચે હતા, તેણે અમી રુહમા નામના દીકરાને જન્મ આપ્યો, જેનો અર્થ """"મારા લોકોએ દયા મેળવી છે.""
"
"About Emi Buendia's Relatives: Regarding Buendia's larger family tree, his paternal and maternal grandparents are one of football's unravelled mysteries while there are no available records of his uncles, aunts, nieces and nephews.
","એમીઆઈ બ્યુએંડિયાના સંબંધીઓ વિશેઃ બ્યુએંડિયાના મોટા કુટુંબના વૃક્ષ વિશે, તેના પિતૃ અને માતાના દાદા-દાદી ફૂટબોલના એક રહસ્યમય રહસ્ય છે જ્યારે તેના કાકાઓ, કાકી, ભત્રીજા અને ભત્રીજાઓનાં કોઈ રેકોર્ડ ઉપલબ્ધ નથી.
"
"After his death, the clinic is entrusted to his niece, Sonakshi Sinha (Baby Bedi).
","તેમના નિધન બાદ ક્લિનિક તેમની પૌત્રી બોબી બેદી (સોનાક્ષી સિંહા) ના નામે થઈ જાય છે.
"
"Also, it seems like Kulusevski doesn't have any nephews or nieces at the time of writing this Life Story.
","ઉપરાંત, એવું લાગે છે કે આ જીવનકથા લખતી વખતે કુલુસ્વસ્કી પાસે કોઈ ભત્રીજા કે ભત્રીજા નથી.
"
"Children, grandchildren, brothers, sisters, nieces and nephews can qualify a taxpayer as dependents for EITC purposes, but parents, grandparents and other types of relationships generally will not.
","બાળકો, પૌત્રો, ભાઇઓ, બહેનો, ભત્રીજાઓ અને ભત્રીજાઓ ઇઆઇટીસી હેતુઓ માટે આશ્રિતો તરીકે કરદાતાને લાયક ઠરે છે, પરંતુ માતાપિતા, દાદા દાદી અને અન્ય પ્રકારના સંબંધો સામાન્ય રીતે નહીં.
"
"Children, grandchildren, brothers, sisters, nieces, and nephews can all qualify as dependents for EITC purposes, but parents, grandparents, and other types of relationships generally will not.
","બાળકો, પૌત્રો, ભાઇઓ, બહેનો, ભત્રીજાઓ અને ભત્રીજાઓ ઇઆઇટીસી હેતુઓ માટે આશ્રિતો તરીકે કરદાતાને લાયક ઠરે છે, પરંતુ માતાપિતા, દાદા દાદી અને અન્ય પ્રકારના સંબંધો સામાન્ય રીતે નહીં.
"
"Consider the old woman in a nursing home or care center, who died with no children or nieces and nephews to bid her farewell in the final moments.
","એક નર્સિંગ હોમ અથવા કેર સેન્ટરમાંની વૃદ્ધ મહિલાનો વિચાર કરો, જે કોઈ પણ બાળકો અથવા ભાણેલાઓ અને ભત્રીજાઓ સાથે અંતિમ તબક્કામાં તેમના વિદાયની બિડ કરવા માટે મૃત્યુ પામ્યા હતા.
"
"Danny does consistently posted some pictures of a particular set of children who are likely to be his nephew and nieces.
","ડેની સતત બાળકોના ચોક્કસ સમૂહની કેટલીક તસવીરો પોસ્ટ કરે છે જેઓ તેના ભત્રીજા અને ભત્રીજા હોવાની સંભાવના છે.
"
"Do you want to give your children, grandchildren, nieces, nephews, friends, siblings, or any other ordinary taxable entity money, perhaps to help them buy their first home, pay for college, or begin building their own investment portfolio?
","શું તમે તમારાં બાળકો, પૌત્રો, ભાણેલાઓ, ભત્રીજાઓ, મિત્રો, બહેન, કે અન્ય કોઈ સામાન્ય કરપાત્ર સંસ્થાને નાણાં આપવા માંગો છો, કદાચ તેમને તેમનું પ્રથમ ઘર ખરીદવા, કોલેજ માટે ચૂકવણી કરવા અથવા પોતાના રોકાણ પોર્ટફોલિયોનું નિર્માણ કરવાનું શરૂ કરવા માગે છે?
"
"Funding a college education for your children, grandchildren, nieces, nephews, or other heirs or beneficiaries.
","તમારા બાળકો, પૌત્રો, ભાણેલાઓ, ભત્રીજાઓ, અથવા અન્ય વારસદારો અથવા લાભાર્થીઓ માટે કોલેજની શિક્ષણ માટે ભંડોળ.
"
"He tells her that he has four sisters, a bunch of nieces and nephews, and his favorite color is blue.
","તે કહે છે કે તેની પાસે ચાર બહેનો છે, ભત્રીજાઓ અને ભત્રીજાઓનો સમૂહ, અને તેનો પ્રિય રંગ વાદળી છે.
"
"He told her his wife's niece was married to one.
","તેણે તેના પતિને કહ્યું કે તેના એક સંબંધીના લગ્ન છે.
"
"His second victim was his 19-year-old niece.
","તેમની બીજી પુત્રી 19 વર્ષની દીક્ષા હતી.
"
"I am not sure of the exact timeline but, I need to give my nieces cousins at some point.
","મને ચોક્કસ સમયની ખાતરી નથી, પરંતુ કોઇક તબક્કે હું મારી નીસીસને કઝિન્સ આપવા માગું છું.
"
"I am the youngest of 10 children and an uncle to 31 nepthews and nieces.
","હું 12 બાળકોમાં સૌથી વૃદ્ધ છું અને 10 નાસીઓ અને ભત્રીજાઓના ડોટિંગ કાકી છું.
"
"I don't care about myself, but I do worry about my niece.
","મને એનામાં જરા પણ રસ નથી, પરંતુ મને મારી બહેનપણીની ચિંતા થાય છે.
"
"I have 3 nieces, and love spending time with them.
","મારે ત્રણ દીકરીઓ છે અને તેમની સાથે સમય વ્યતીત કરી રહ્યો છે.
"
"If none exist, parents, nieces and nephews, siblings, and other descendants may file a claim.
","જો કંઈ છે, તો પછી ભાઈઓ, બહેનો, દાદી, ભત્રીજાઓ અને અન્ય બંધ ન સંબંધીઓ દાવો કરી શકે ત્યજી મિલકત છે.
"
"If there is no surviving spouse, nor children, parents, brothers or sisters, the property is divided equally among the deceased's nephews and nieces;
","જો ત્યાં કોઈ પતિ / પત્ની અથવા બાળકો ન હોય, તો મૃતકની મિલકત તેના પિતા, માતા, ભાઈઓ અને બહેનો અથવા તેના વંશજો સમાન ભાગોમાં વહેંચાયેલી હોય છે.
"
"If you have a hereditary myopathy, then there is a chance that some of your siblings, children, nieces, and nephews, or other relatives could also develop myopathy.
","જો તમારી પાસે વંશપરંપરાગત મેયોપથી છે, તો પછી તમારા ભાઈબહેન, તમારા બાળકો, ભાણેલાઓ અને ભત્રીજાઓ, અથવા અન્ય સંબંધીઓ પણ મેયોપીથી વિકસિત કરી શકે તેવી એક તક છે.
"
"If you have a hereditary myopathy, then there is a chance that some of your siblings, your children, nieces and nephews, or other relatives could also develop myopathy.
","જો તમારી પાસે વંશપરંપરાગત મેયોપથી છે, તો પછી તમારા ભાઈબહેન, તમારા બાળકો, ભાણેલાઓ અને ભત્રીજાઓ, અથવા અન્ય સંબંધીઓ પણ મેયોપીથી વિકસિત કરી શકે તેવી એક તક છે.
"
"If you have a hereditary myopathy, then there is a chance that some of your siblings, your children, nieces, and nephews, or other relatives could also develop myopathy.
","જો તમારી પાસે વંશપરંપરાગત મેયોપથી છે, તો પછી તમારા ભાઈબહેન, તમારા બાળકો, ભાણેલાઓ અને ભત્રીજાઓ, અથવા અન્ય સંબંધીઓ પણ મેયોપીથી વિકસિત કરી શકે તેવી એક તક છે.
"
"It has made a lot of money for a lot of families, and in many cases, multiple generations of families: men, women, children, nieces, nephews, grandchildren, all of whom are living off the dividends, interest, and rents of the well-constructed portfolios the managing directors have built on their behalf.
","તે ઘણાં પરિવારો માટે ઘણાં પૈસા બનાવી લીધા છે, અને ઘણા કિસ્સાઓમાં, પરિવારોની બહુવિધ પેઢીઓ; પુરુષો, સ્ત્રીઓ, બાળકો, ભાણેલાઓ, ભત્રીજાઓ, પૌત્રો, જે બધા જ ડિવિડન્ડ, રુચિ અને સુવ્યવસ્થિત પોર્ટફોલિયોના મકાનનું સંચાલન કરે છે, જે મેનેજિંગ ડિરેક્ટર તેમના વતી બાંધ્યા છે.
"
"It has made a lot of money for a lot of families, and in many cases, multiple generations of families; men, investments kept, children, nieces, nephews, grandchildren, all investments kept whom are living off the dividends, interest, and rents of the well-constructed portfolios the managing directors have built on their behalf.
","તે ઘણાં પરિવારો માટે ઘણાં પૈસા બનાવી લીધા છે, અને ઘણા કિસ્સાઓમાં, પરિવારોની બહુવિધ પેઢીઓ; પુરુષો, સ્ત્રીઓ, બાળકો, ભાણેલાઓ, ભત્રીજાઓ, પૌત્રો, જે બધા જ ડિવિડન્ડ, રુચિ અને સુવ્યવસ્થિત પોર્ટફોલિયોના મકાનનું સંચાલન કરે છે, જે મેનેજિંગ ડિરેક્ટર તેમના વતી બાંધ્યા છે.
"
"It has made a lot of money for a lot of families, and in many cases, multiple generations of families; men, women, children, nieces, nephews, grandchildren, all of whom are living off the dividends, interest, and rents of the well-constructed portfolios the managing directors have built on their behalf.
","તે ઘણાં પરિવારો માટે ઘણાં પૈસા બનાવી લીધા છે, અને ઘણા કિસ્સાઓમાં, પરિવારોની બહુવિધ પેઢીઓ; પુરુષો, સ્ત્રીઓ, બાળકો, ભાણેલાઓ, ભત્રીજાઓ, પૌત્રો, જે બધા જ ડિવિડન્ડ, રુચિ અને સુવ્યવસ્થિત પોર્ટફોલિયોના મકાનનું સંચાલન કરે છે, જે મેનેજિંગ ડિરેક્ટર તેમના વતી બાંધ્યા છે.
"
"It's a tax benefit Congress gives families who aren't rich enough to be subject to the estate tax but who diligently built wealth by acquiring stocks, real estate investments, or other property (such as construction equipment) throughout their lifetime and want to pass that money on to their children, grandchildren, nieces, nephews, or other heirs.
","તે ટેક્સ બેનિફિટ કોંગ્રેસ છે, જે પરિવારોને સમૃદ્ધ ન હોય તેવા સંપત્તિ કરને આધીન ન હોય પરંતુ જેઓ તેમના જીવનકાળ દરમિયાન શેરો , રિયલ એસ્ટેટ રોકાણ અથવા અન્ય સંપત્તિ (જેમ કે બાંધકામ સાધનસામગ્રી) હસ્તગત કરીને સંપત્તિનું નિર્માણ કરે છે , અને તે પસાર કરવા માગે છે તેમના બાળકો, પૌત્રો, ભાણેલાઓ, ભત્રીજાઓ, અથવા અન્ય ચીજોનો નાણાં.
"
"Life insurance can be a great way to pay a little each month, and leave a substantial amount to a charitable cause, or to children, grandchildren, nieces, or nephews.
","લાઇફ ઇન્શ્યોરન્સ દર મહિને થોડો પગાર ચૂકવવાનો ઉત્તમ રસ્તો હોઈ શકે છે, અને સખાવતી કારણ, અથવા બાળકો, પૌત્રો, ભાણેલાઓ અથવા ભત્રીજાઓ માટે નોંધપાત્ર રકમ છોડી શકે છે.
"
"More so, not much is known about the right backs uncles and aunts while his nephews and nieces have not been identified in notable events of his early life till date.
","તેથી વધુ, જમણી પીઠના કાકાઓ અને કાકીઓ વિશે વધુ જાણીતું નથી, જ્યારે તેના ભત્રીજા અને ભત્રીજાઓ તેમના પ્રારંભિક જીવનની નોંધપાત્ર ઘટનાઓમાં આજ સુધી ઓળખવામાં આવી નથી.
"
"My niece was probably 12 years old that time.
","એ વખતે મારી ઉંમર કદાચ બારેક વર્ષની હશે.
"
"My thoughts and feelings of fear weren't just about that moment, but about a future where my children, nieces and nephews will have to face the same discrimination and hate.
","""ગુરલેને આગળ કહ્યુંઃ """"મારા વિચારો અને ભયની લાગણી તે ક્ષણ વિશે જ નહોતી, પરંતુ એક ભવિષ્ય વિશે છે જ્યાં મારા બાળકો, ભત્રીજા અને ભત્રીજાઓને સમાન ભેદભાવ અને નફરતનો સામનો કરવો પડશે.""
"
"Question: My niece is 15 years old.
","સવાલઃ મારી દીકરી 15 વર્ષની છે.
"
"She eventually went to the wonderful word of god and prayed about it and prayed and finally she got her answer and I now 2 nieces and a great god fearing brother-in-law !!
","છેવટે ઈશ્વરના અદ્ભુત શબ્દ ગયા અને તે વિશે પ્રાર્થના અને પ્રાર્થના અને છેલ્લે તે હવે તેના જવાબ અને હું મળી 2 nieces અને એક મહાન દેવ ભાઇ ઈન કાયદો ભય!
"
"She has come to Delhi to attend her niece's wedding.
","તે પોતાના કઝીનના લગ્નમાં હાજરી આપવા માટે દિલ્હી પહોંચી હતી.
"
"Similarly, the defender has uncles, aunts, cousins nephews and nieces that have not been identified in his childhood story and notable events of his life till date.
","એ જ રીતે, ડિફેન્ડર પાસે કાકાઓ, સાવકાઓ, પિતરાઇ ભત્રીજાઓ અને ભાઇઓ છે જે તેમના બાળપણની વાર્તા અને તેમની જીંદગીની નોંધપાત્ર ઘટનાઓ સુધી ઓળખાયેલી નથી.
"
"Similarly, the defender has uncles, aunts, cousins nephews and nieces that have not been identified in his childhood story and notable events of his life to date.
","એ જ રીતે, ડિફેન્ડર પાસે કાકાઓ, સાવકાઓ, પિતરાઇ ભત્રીજાઓ અને ભાઇઓ છે જે તેમના બાળપણની વાર્તા અને તેમની જીંદગીની નોંધપાત્ર ઘટનાઓ સુધી ઓળખાયેલી નથી.
"
"Similarly, there are no records of Cancelo's uncles, aunts, nephews and nieces while his cousins have not been identified in notable events of his early life till date.
","એ જ રીતે, કેન્સ્લોના કાકાઓ, કાકી, ભત્રીજાઓ અને ભત્રીજાઓનાં કોઈ રેકોર્ડ નથી, જ્યારે તેમના પિતરાઇ ભાઇઓની આજકાલની શરૂઆતની જિંદગીની નોંધપાત્ર ઘટનાઓમાં તેની ઓળખ થઈ નથી.
"
"Similarly, there are no records of Cancelo's uncles, aunts, nephews, and nieces while his cousins have not been identified in notable events of his early life to date.
","એ જ રીતે, કેન્સ્લોના કાકાઓ, કાકી, ભત્રીજાઓ અને ભત્રીજાઓનાં કોઈ રેકોર્ડ નથી, જ્યારે તેમના પિતરાઇ ભાઇઓની આજકાલની શરૂઆતની જિંદગીની નોંધપાત્ર ઘટનાઓમાં તેની ઓળખ થઈ નથી.
"
"Similarly, there are no records of Greenwood's aunts, uncles, nieces and nephews while his cousins have not been identified in notable events of his early life till date.
","એ જ રીતે, ગ્રીનવુડની કાકી, કાકાઓ, ભત્રીજાઓ અને ભત્રીજાઓનો કોઈ રેકોર્ડ નથી જ્યારે તેમના પિતરાઇ ભાઇઓ આજકાલ તેમના પ્રારંભિક જીવનની નોંધપાત્ર ઘટનાઓમાં ઓળખાઈ નથી.
"
"Similarly, there are no records of Tielemans' uncles, aunts, nieces and nephews while his cousins have not been identified in notable events of his early life till date.
","તેવી જ રીતે, ટાયલેમન્સના કાકાઓ, સાવકાઓ, ભાઇઓ અને ભત્રીજાઓનો કોઈ રેકોર્ડ નથી, જ્યારે તેમના પિતરાઇઓ તેમના પ્રારંભિક જીવનની નોંધપાત્ર ઘટનાઓમાં ઓળખી કાઢવામાં આવ્યા નથી.
"
"Similarly, there are no records of Tielemans' uncles, aunts, nieces and nephews while his cousins have not been identified in notable events of his early life to date.
","તેવી જ રીતે, ટાયલેમન્સના કાકાઓ, સાવકાઓ, ભાઇઓ અને ભત્રીજાઓનો કોઈ રેકોર્ડ નથી, જ્યારે તેમના પિતરાઇઓ તેમના પ્રારંભિક જીવનની નોંધપાત્ર ઘટનાઓમાં ઓળખી કાઢવામાં આવ્યા નથી.
"
"Similarly, there are no records of his aunts, uncles, nieces and nephews while his cousins have not been identified in notable events of his early life till date.
","એ જ રીતે, કેન્સ્લોના કાકાઓ, કાકી, ભત્રીજાઓ અને ભત્રીજાઓનાં કોઈ રેકોર્ડ નથી, જ્યારે તેમના પિતરાઇ ભાઇઓની આજકાલની શરૂઆતની જિંદગીની નોંધપાત્ર ઘટનાઓમાં તેની ઓળખ થઈ નથી.
"
"So he married his niece.
","તેથી તેણે પોતાની દાદી સાથે લગ્ન કરી લીધા.
"
"There are no records of the Norwegian's uncles, aunts and nieces and cousins at the time of updating his Biography.
","તેની બાયોગ્રાફી અપડેટ કરતી વખતે નોર્વેના કાકાઓ, કાકીઓ અને ભત્રીજાઓ અને પિતરાઇ ભાઇઓનાં કોઈ રેકોર્ડ નથી.
"
"These children are not necessarily your biological offspring but could be grandchildren, nieces or nephews, an adopted child, or even a neighbor's child for whom you've taken on a maternal role.
","આ બાળકો તમારા જૈવિક સંતાનની આવશ્યકતા નથી, પરંતુ પૌત્રો, ભાણેલાઓ અથવા ભત્રીજાઓ, દત્તક લીધેલા બાળક, અથવા પડોશીનું બાળક પણ હોઇ શકે છે, જેમને તમે માતૃત્વની ભૂમિકામાં લીધી છે.
"
"These children do not necessarily mean biological offspring but they can be your grandchildren, nieces or nephews, an adopted child, or even a neighbour's child for whom you play the role of a parent.
","આ બાળકો તમારા જૈવિક સંતાનની આવશ્યકતા નથી, પરંતુ પૌત્રો, ભાણેલાઓ અથવા ભત્રીજાઓ, દત્તક લીધેલા બાળક, અથવા પડોશીનું બાળક પણ હોઇ શકે છે, જેમને તમે માતૃત્વની ભૂમિકામાં લીધી છે.
"
