eng_Latn,guj_Gujr
"The CBI has also questioned Trinamool Congress MP Abhishek Banerjee's wife Rujira and his sister-in-law Menaka Gambhir in connection with the case.
","CBIએ તૃણમૂક કોંગ્રેસના નેતા અભિષેક બેનર્જીની પત્ની રૂજિરા અને તેની સબંધી મેનકા ગંભીરની પણ પૂછપરછ કરી હતી.
"
"Raj Kundra posed with his wife Shilpa Shetty and sister-in-law Shamita.
","અહીં શિલ્પા પોતાની માં અને બહેન શમિતા શેટ્ટી અને પતિ રાજ કુંદ્રા સાથે જોવા મળી.
"
"Kareena also posed with sister-in-law Soha Ali Khan, Neha Dhupia and a few close friends.
","સોહા અલી ખાન, કુણાલ ખેમૂ, શિખા તલસાનિયા અને તેના અન્ય નજીકના મિત્રો પણ પાર્ટીમાં જોડાયા હતા.
"
"Condoling the loss, Rajiv’s sister-in-law and Rishi Kapoor’s wife actress Neetu Kapoor shared a post on social media along with a picture of the late actor.
","દિવંગત ઋષિ કપૂરના પત્ની અને એક્ટ્રેસ નીતૂ કપૂરે ઈન્સ્ટાગ્રામ પર રાજીવ કપૂરની એક તસવીર શેર કરી છે અને શોક વ્યક્ત કર્યો છે.
"
"Kashmera had entered the Bigg Boss 13 house to support her sister-in-law Aarti Singh.
","જ્યારે 'બિગ બોસ 13'ના ઘરમાં આરતી હતી ત્યારે કાશ્મીરા તેને સપોર્ટ કરવા માટે પહોંચી હતી.
"
"Priyanka Chopra's sister-in-law Sophie Turner is all set to marry Joe Jonas for the second time with singer Joe Jonas.
","પ્રિયંકા ચોપરાના જેઠ જોનસ તેની ગર્લફ્રેન્ડ સોફી ટર્નર સાથે બીજી વાર લગ્ન બંધનમાં બંધાશે.
"
"The film is based on the life of India's oldest shooters Chandro Tomar and her sister-in-law Prakashi Tomar.
","આ ફિલ્મ શૂટર્સ દાદી તરીકે જાણીતી ચન્દ્રો તોમર અને પ્રકાશી તોમરના જીવન પર આધારિત છે.
"
"She feels happiness with her family - her generous husband, two lovely daughters, and her friendly sister-in-law.
","તેણીની સ્થિતિ અને તેણીના જીવનથી સંતુષ્ટ છે મારી સમજમાં સુખી કુટુંબ સુંદર પત્ની, પ્રેમાળ પતિ અને બે મોહક બાળકો છે.
"
"Along with her came her sister-in-law.
","આથી તેની બહેનપણી પણ સાથે આવી હતી.
"
"A few days later I told my sister-in-law.
","થોડા દિવસ પછી મેં ભાનુમતિને કીધું .
"
"Also at the party were Anil's brother and sister-in-law, Sanjay and Maheep Kapoor.
","સંજય કપૂર, શનાયા કપૂર અને માહિપ કપૂર પણ આ પાર્ટીમાં જોવા મળ્યા.
"
"However, later, her sister-in-laws started to harass her.
","પરંતુ બાદમાં તેના સાસરીયાઓએ તેને ત્રાસ આપવાનું શરૂ કર્યું.
"
"The Ambani family, including Mukesh Ambani’s brother Anil, sister-in-law Tina, sons Anand and Aakash, wife Neeta and to-be daughters-in-law Radhika Merchant and Shloka Mehta were spotted at the venue.
","તાજતરમાં જ મુકેશ અંબાણી પરિવારના સભ્યો પુત્ર આકાશ અંબાણી તેમના પત્ની શ્લોકા અંબાણી,પુત્ર અનંત અંબાણી, પુત્રી ઇશા અંબાણી તેમના પતિ આનંદ પિરામલ સાથે દ્વારકા નગરીએ દ્વારકાધિશના દર્શને પહોંચ્યા હતા.
"
"That’s why she will be my sister-in-law in the future.
","અતે ભવિષ્યમાં તે જ મારી પત્ની બનશે.
"
"Also preceding her in death were her mother, father, brother, and sister-in-law.
","બહેનની હત્યા કરવામાં સગા ભાઈ ઉપરાંત તેના પિતા ,કાકા ,પિતરાઈ ભાઈ ,પણ શામેલ હતા.
"
"Bollywood actress Priyanka Chopra is known to share a great relationship with her sister-in-law Sophie Turner.
","પ્રિયંકા ચોપરાનું પોતાની જેઠાણી સોફી ટર્નર સાથે ખૂબ સારું બોન્ડિંગ છે.
"
"Man, wife held for murder of sister-in-law in Ahmedabad
","દહેજના મામલે અમદાવાદી પતિએ નશાની હાલતમાં પત્નીને માર મારતા ગુનો દાખલ
"
"Neetu Kapoor, Rajiv Kapoor's sister-in-law, shared a statement on her Instagram account.
","નીતુ કપૂરે તેમના ઇન્સ્ટાગ્રામ એકાઉન્ટ પર રાજીવ કપૂરના અવસાન અંગે માહિતી આપી છે.
"
"The same thing happened with my sister-in-law’s daughter.
","દીકરીને પણ એવું જ થયું.
"
"Ahmedabad: Tired of being harassed by husband, sister-in-law, woman immolates herself
","અમદાવાદ: ભાણિયો જ બન્યો માસીની હત્યાનો તરસ્યો, કર્યો છરી વડે હુમલો
"
"Allegations have been made against the wife and sister-in-law of Chief Minister Mamata Banerjee's nephew and Trinamool Congress MP Abhishek Banerjee in connection with its probe into the scam.
","પશ્ચિમ બંગાળના CM મમતા બેનર્જીના ભત્રીજા અને TMC સાંસદ અભિષેક બેનર્જી અને તેમની પત્ની રૂજીરા બેનર્જીને કોલસા કૌભાંડ સાથે સંબંધિત મની લોન્ડરિંગ કેસમાં આંચકો લાગ્યો છે.
"
"Actor Neetu Kapoor, wife of late actor Rishi Kapoor and Rajiv Kapoor's sister-in-law, shared a statement on Instagram.
","ઋષિ કપૂરના પત્ની અને એક્ટ્રેસ નીતૂ કપૂરે ઈન્સ્ટાગ્રામ સ્ટોરીમાં રાજીવ કપૂરને ખળખળાટ હસતી તસવીર શેર કરીને તેમને યાદ કર્યા છે.
"
"Mumbai: Actors Bhumi Pednekar and Tapsee Pannu have wrapped up shooting for their upcoming film “Saand Ki Aankh”, based on old sharpshooters – Chandro Tomar and her sister-in-law Prakashi Tomar.
","મુંબઈ: અભિનેત્રી ભૂમિ પેડણેકર અને તાપસી પન્નૂએ પોતાની આગામી ફિલ્મ સાંડ કી આંખની શૂટિંગ પુરી કરી લીધી છે.
"
"The woman has alleged that her husband had an affair with his sister-in-law
","પરિણીતાએ પતિના તેના મિત્રની પત્ની સાથે આડા સંબંધ હોવાની ફરિયાદ નોંધાવી
"
"The ED had chargesheeted former Telecom Minister Dayanidhi Maran, his brother Kalanithi and sister-in-law Kavery Kalanithi as accused in the case too.
","આ પહેલા ઇડીએ દાખલ કરેલી ચાર્જશીટમાં પૂર્વ ટેલિકોમ મંત્રી દયાનિધી મારન, તેના ભાઇ કલાનિધી મારન તથા અન્યો સામે આરોપ લગાવ્યા હતા.
"
"At Sonam Kapoor's reception, Rishi Kapoor reportedly got into an ugly spat with Salman Khan's sister-in-law Seema Khan (Sohail Khan's wife).
","ત્યારે સોનમ કપૂરના રિસેપ્શનમાં તેઓ સોહેલ ખાનની પત્ની સીમા ખાન સાથે બાખડી પડ્યા હતા.
"
"At Sonam Kapoor's reception, Rishi Kapoor reportedly got into an ugly spat with Salman Khan's sister-in-law Seema Khan (Sohail Khan's wife).
","સોનમ કપૂરના રિસેપ્શનમાં સલમાન ખાન અને રિશી કપૂર વચ્‍ચે ઝઘડો થયા બાદ રિશી કપૂરની સોહેલ ખાનની પત્ની સાથે બોલાચાલીઃ બાદમાં નીતુ કપૂરે માફી માંગી
"
"The guests on the show included Kareena's sister Karisma Kapoor, Mallika Dua, BFFs Malaika Arora and Amrita Arora, sister-in-law Soha Ali Khan amongst many others.
","આ પાર્ટીમાં કરીનાની બેસ્ટી અમ્રિતા અને મલાઈકા અરોરા, સૈફની બહેન સોહા અલી ખાન, જમાઈ કુનાલ ખેમુ પણ ઉપસ્થિત હતા.
"
"He was living with his brother and sister-in-law.
","તે પોતાના ભાઈ અને ભત્રીજા સાથે રહેતા હતા.
"
"Actress Neetu Kapoor, Rajiv's sister-in-law and Rishi Kapoor's wife expressed her condolences and shared a post on social media along with a picture of the late actor.
","હવે ઋષિ કપૂરની પત્ની અને અભિનેત્રી નીતુ કપૂરે સોશિયલ મીડિયા પર એક ભાવનાત્મક પોસ્ટ શેર કરી છે.
"
"Actress Kareena Kapoor Khan recently stepped out with her son Jehangir Ali Khan to attend sister-in-law Soha Ali Khan and Kunal Kemmu’s daughter Inaaya’s birthday.
","હાલમાં જ સોહા અલી ખાન અને કુણાલ ખેમૂની દીકરી ઇનાયા ખેમૂના બર્થ ડેના ખાસ અવસર પર કરીના કપૂર સ્પોટ થઇ હતી.
"
"The CBI sending notices to Abhishek Banerjee’s wife and his sister-in-law in a coal smuggling case ahead of the crucial assembly polls in West Bengal has triggered a bitter slugfest between the TMC and its primary opponent the Bharatiya Janata Party (BJP).
","પશ્ચિમ બંગાળ વિધાનસભાની ચૂંટણી પહેલા જ મુખ્યમંત્રી મમતા બેનર્જીના ભત્રીજા સાંસદ અભિષેક બેનર્જી અને તેની પત્નીને સીબીઆઈએ નોટિસ આપી હતી.
"
"Sandesara’s other family members, including brother Chetan Sandesara and sister-in-law Diptiben Sandesara, are also believed to be hiding in Nigeria.
","સાંડેસરાનો ભાઇ ચેતન સાંડેસરા અને દિપ્તી સાંડેસરા પણ નાઇજિરીયામાં છુપાયા હોવાની આશંકા છે.
"
"Salman Khan’s sister-in-law Seema, who is the wife of Sohail Khan, was also present.
","સલમાન ખાનના ભાઈ સોહેલ ખાને પણ સીમા સચદેવ સાથે ભાગીને લગ્ન કર્યાં હતાં.
"
"Sophie, who is married to Joe Jonas, is sister-in-law to Priyanka Chopra and her husband Nick Jonas.
","સોફી ટર્નર, પ્રિયંકાના પતિ નિક જોનાસના મોટા ભાઈ જો જોનાસની પત્ની છે.
"
"The film is based on the life of India's oldest shooters Chandro Tomar and her sister-in-law Prakashi Tomar.
","આ ફિલ્મ ભારતની બે વૃદ્ધા મહિલા શુટર ચંદ્રો તોમર અને તેમની દેરાણી પ્રકાશી તોમરના જીવન પર આધારિત છે.
"
"Also, the actress Kareena Kapoor Khan attended her sister-in-law's baby shower with sister Karisma Kapoor .
","કરીના કપૂર ખાન પણ તેની બહેનકરિશ્મા કપૂર સાથે આવી.
"
"NCB Zonal Director Sameer Wankhede's sister-in-law has filed a complaint against NCP leader and Maharashtra minister Nawab Malik for outraging her modesty.
","એનસીબી ઝોનલ ઓફિસર સમીર વાનખેડેની બહેન યાસ્મીન વાનખેડેએ મહારાષ્ટ્રનાં પ્રધાન નવાબ મલિક પર આકરા પ્રહારો કર્યા છે.
"
"NCB Mumbai zonal director Sameer Wankhede hit back at Nawab Malik after the Maharashtra minister alleged that his sister-in-law was involved in the drug business.
","મુંબઈ ક્રૂઝ ડ્રગ્સ કેસમાં NCBના ઝોનલ ડાયરેક્ટર સમીર વાનખેડે (Sameer Wankhede) અને તેમના પરિવાર પર તમામ આરોપો લગાવનાર મહારાષ્ટ્રના મંત્રી નવાબ મલિક (Nawab Malik) હવે પોતે મુશ્કેલીમાં જોવા મળી રહ્યા છે.
"
"Raj Kundra posed with his wife Shilpa Shetty and sister-in-law Shamita.
","અહીં શિલ્પા તેની માતા અને બહેન શમિતા શેટ્ટી અને પતિ રાજ કુંદ્રા સાથે જોવા મળી હતી.
"
"A case has been registered against the woman's husband, father-in-law, mother-in-law and sister-in-law, the police added.
","આ મામલે મહિલાએ પતિ, સાસુ અને સસરા વિરુદ્ધ પોલીસ ફરિયાદ નોંધાવી છે.
"
"The Ambani family, including Mukesh Ambani’s brother Anil, sister-in-law Tina, sons Anand and Aakash, wife Neeta and to-be daughters-in-law Radhika Merchant and Shloka Mehta were spotted at the venue.
","આ ઉપરાંત મુકેશ અંબાણીના ભાઈ અનિલ અંબાણી, તેમની પત્ની ટીના અંબાણી, રતન તાતા, મહેન્દ્ર સમૂહના અધ્યક્ષ આનંદ મહિન્દ્રા, કોટક મહિન્દ્રાના કાર્યકારી ઉપાધ્યક્ષ અને પ્રબંધ નિદેશક ઉદય કોટક, આદિત્ય બિરલા સમૂહના અધ્યક્ષ કુમાર મંગલમ બિરલા, ઝી સમૂહના અધ્યક્ષ સુભાષ ચંદ્રા પણ સામેલ થયા હતાં.
"
"Man, wife held for murder of sister-in-law in Ahmedabad
","અમદાવાદમાં પતિએ પત્નીના ગુપ્તાંગમાં ડિસમિસ મારી હત્યાનો કર્યો પ્રયાસ
"
"A case has been registered against the woman's husband, father-in-law, mother-in-law and sister-in-law, the police added.
","પોલીસે પતિ, સસરા, સાસુ અને નણંંદ વિરૂદ્ધ ફરિયાદ નાધી તપાસ હાથ ધરી છે.
"
"A case was registered against her husband, mother-in-law and sister-in-law.
","આ અંગે પતિ, સાસુ અને સસરા સામે ફરીયાદ નોંધાઈ છે.
"
"Kareena Kapoor Khan wishes sister-in-law on her birthday
","કરીના કપૂર ખાન બીજીવાર થઈ પ્રેગનન્ટ, બહેન અને ચાહકોએ પાઠવ્યા અભિનંદન
"
"Akshay's mother Reena Kapoor is Anil and Boney Kapoor's sister and Sridevi's sister-in-law.
","આલિયા ઉપરાંત રણબીરની મા નીતુ કપૂર અને બહેન રિદ્ધિમા કપૂર સાહની પણ હતાં.
"
"Ahmedabad: Tired of being harassed by husband, sister-in-law, woman immolates herself
","અમદાવાદ: દારૂડીયા પતિના ત્રાસથી કંટાળીને પરિણીતાએ કર્યો આપઘાતનો પ્રયાસ
"
"The accused killed his mother, brother and sister-in-law
","જેની અદાવત રાખી આરોપીએ દાદી અને પૌત્રને મોતને ઘાટ ઉતારી દીધા
"
"Actress Kareena Kapoor Khan is very fond of her sister-in-law Soha Ali Khan , with whom she shares a great rapport and relationship.
","સારા અલી ખાન અને કરીના કપૂર સારૂં બોન્ડિંગ શેર કરે છે, તે કરીનાની મોટી ફેન પણ છે.
"
"His wife and sister-in-law also died.
","તેમની સાથે તેમના પત્ની અને ટુકડીના જવાનોનું પણ નિધન થયુ છે.
"
"Bollywood actress Priyanka Chopra recently took to social media and shared a cute post for her sister-in-law Sophie Turner.
","બોલીવુડ અભિનેત્રી પ્રિયંકા ચોપરાએ તાજેતરમાં સોશયલ મીડિયા પર પોતાની એક તસ્વીર મુકી છે.
"
"The police have lodged a case against three people - her husband, father-in-law and sister-in-law - in connection with the incident.
","તેને લઈને તેના પતિ, સાસુ-સસરા સહિત ચાર લોકોની વિરુદ્ધ પોલીસમાં ફરિયાદ આપી છે.
"
"Her sister-in-law Tina, who is the wife of Anil Ambani, was also present.
","આકાશના કાકી અને અનિલ અંબાણીના પત્ની ટીના અંબાણી પણ જોવા મળ્યા.
"
"A woman plays the role of a daughter, mother, wife, daughter-in-law, sister-in-law and so on.
","મહિલાઓ એક પત્ની, પુત્રી, પુત્રવધૂ, રસોઇયણ, માતા, મેઇડ અને બીજી ઘણી બધી ભૂમિકા ભજવતી હોય છે.
"
"In attendance were Janhvi Kapoor, sister-in-law Mira Rajput, Shahid Kapoor and mom Neelima Azeem.
","તે દરમિયાન શાહિદ કપૂર, મીરા રાજપૂત, ઇશાન ખટ્ટર, જાહન્વી કપૂર અને શાહિદની માતા નીલિમા અજીમ જોવા મળ્યા હતા.
"
"Actor Neetu Kapoor, wife of late actor Rishi Kapoor and Rajiv Kapoor's sister-in-law, shared a statement on Instagram.
","દિવંગત ઋષિ કપૂરના પત્ની અને એક્ટ્રેસ નીતૂ કપૂરે ઈન્સ્ટાગ્રામ પર રાજીવ કપૂરની એક તસવીર શેર કરી છે અને શોક વ્યક્ત કર્યો છે.
"
"Kareena Kapoor shares photo of her 'favourite boys', sister-in-law Saba Ali Khan pens post for her and Saif
","સબા અલી ખાને શેર કરેલી તૈમૂરની તસવીર કરીના કપૂરને ખૂબ ગમી
"
"Actor Priyanka Chopra along with sister-in-law Sophie Turner had also paid her a visit.
","હાલમાં જ પ્રિયંકા ચોપરાની જેઠાણી અને એક્ટ્રેસ સોફી ટર્નર પણ તેના પતિ સાથે આ દેખાવમાં સામેલ થઇ હતી.
"
"Aditya Roy Kapur also arrived at the birthday bash of his sister-in-law.
","આદિત્ય રોય કપૂર પણ આલિયાની બર્થ ડે પાર્ટીમાં આવ્યો હતો.
"
"Her sister-in-law’s 18-month-old son died.
","બીજા પુત્રી 18 મહિના વર્ષની ઉંમરે મૃત્યુ પામ્યા હતા.
"
"The film 'Saand Ki Aankh' is a biographical film based on the life story of sharpshooters Chandro Tomar and her sister-in-law Prakashi Tomar.
","શૂટર દાદી ચંદ્રો તોમર અને રિવોલ્વર દાદી પ્રકાશી તોમરના જીવન પર આધારિત ફિલ્મ ‘સાંડ કી આંખ'(Saand Ki Aankh) નું ટ્રેલર રિલીઝ કરવામાં આવ્યું છે.
"
"Both of Deliverance's sisters-in-law, Abigail Faulkner Sr. and Elizabeth Johnson Sr., were examined on August 30.
","મુક્તિદાતાની બહેનો, એબીગેઇલ ફોકનર સીરીઅને એલિઝાબેથ જોહ્નસન સીરીની બંનેની 30 ઓગસ્ટના રોજ તપાસ કરવામાં આવી હતી.
"
"How is your relationship with your brother and sisters-in-law?
","આપના ભાઈ કે બહેન સાથે આપના સંબંધે કેટલા મધુર છે?
"
"A mother and father-in law, two brothers-in-law, two sisters-in-law, he had two children and a nephew.
","બે જેઠ, બે જેઠાણી, એક દિયર, સાસુ-સસરા અને બે ભત્રીજી છે.
"
"The two are sisters-in-law.
","આ બન્ને સગી બહેનો છે.
"
"Among the six dead were his two sisters-in-law and a brother-in-law.
","મૃતક છ ભાઇ અને બે બહેનમાં બીજો અને કુંવારો હતો.
"
"The two are sisters-in-law.
","બંન્ને સગી બહેન છે.
"
"Directed by Tushar Hiranandani, the film is based on the lives of sisters-in-law Chandro Tomar and Prakashi Tomar.
","તુષાર હિરાનંદાની દિગ્દર્શિત આ ફિલ્મ શૂટર ચંદ્રો અને પ્રકાશી તોમરના જીવન પર આધારિત છે.
"
"brother-in-law, sisters-in-law, nieces, nephews,
","ભાણ્યાઓ, ભાણકીઓ, ભત્રીજીઓ વગેરે.
"
