eng_Latn,guj_Gujr
"ALANNA PANDAY: Alanna Panday is the niece of actor Chunkey Panday.
","અનન્યા પાંડે અભિનેતા ચંકી પાંડેની દીકરી છે.
"
"Antara is the niece of Anil Ambani's wife Tina Ambani.
","બીજા નંબર ઉપર અનિલ અંબાણીની પત્ની ટીના અંબાણી છે.
"
"Antara is the niece of Anil Ambani's wife Tina Ambani.
","અંતરા, અનિલ અંબાણીની પત્ની અને બોલિવૂડ એક્ટ્રેસ ટીના અંબાણી ના બહેનની દીકરી છે.
"
"Mr Verma was married to Rupa Ganguly, daughter of late actor Ashok Kumar and niece of his actor-singer brother Kishore.
","મહાન અભિનેતા અશોક કુમારના દીકરી અને અભિનેત્રી પ્રીતિ ગાંગુલીના બહેન રૂપા ગાંગુલી સાથે એમના લગ્ન થયા હતા.
"
"The accused had raped his niece.
","દોષીતે પોતાની સાવકી પુત્રી સાથે રેપ કર્યો હતો.
"
"Antara is the niece of Anil Ambani's wife Tina Ambani.
","ટીdના અંબાણી અનિલ અંબાણીના પત્ની છે.
"
"Baahubali director S S Rajamouli's son S S Karthikeya got engaged to actor Jagapathi Babu's niece Pooja Prasad recently.
","તાજેતરમાં જ એક્ટ્રેસ બાહુબલી ડાયરેક્ટર એસ એસ રાજામૌલીના પુત્ર કાર્તિકેયના લગ્ન એટેન્ડ કરવા પહોંચી હતી, અહીં જયુપુરમાં તેની સાથે તેનો બૉયફ્રેન્ડ રોહમન અને ફેમિલી પણ આવી હતી.
"
"Nikunj, a niece of Congress MLA Punam Parmar, has lost in Tarapur district panchayat seat.
","આ તરફ આણંદ ખાતે પણ તારાપુર બેઠકના ધારાસભ્ય પૂનમ પરમારના ભત્રિજા નિકુંજ પરમારને પણ હારનો સામનો કરવો પડ્યો છે.
"
"Saba Ali Khan has shared a fresh batch of baby pictures of her niece, actor Sara Ali Khan .
","પોતાના ચાહકોને ઈદની શુભેચ્છા પાઠવતા અભિનેત્રી સારા અલી ખાન (Sara Ali Khan)એ તેના બાળપણની ઈદ તસવીર રજૂ કરી છે.
"
"Salman Khan has shared an adorable picture of his niece and nephews on Instagram.
","સલમાન ખાને ટ્વિટર પર પોતાના ભત્રીજાનો ફોટો શેર કરતા એક ઇમોશનલ પોસ્ટ લખી છે.
"
"She is his niece.
","તે પોતાની નાની પરી છે.
"
"One of them was his niece’s girls, and two of them were mother’s girls.
","એક હતાં દાદીમા, અને એક હતી દાદીમાની દિકરી.
"
"Arti Singh is the sister of Krushna Abhishek and niece of Govinda.
","કૃષ્ણા અભિષેક ગોવિંદા અને સુનીતાનો ભાણો છે.
"
"Aamir Khan along with his wife Kiran Rao, son Azad Rao Khan and daughter Ira Khan attended his niece Zayn Marie Khan's wedding with Abhishek Saha in Alibaug over the weekend.
","આ પાર્ટીમાં આમિર ખાનની પત્ની કિરણ રાવે તેના ચાર વર્ષના દીકરા આઝાદ સાથે તેમજ ઐશ્વર્યા રાય બચ્ચને દીકરી આરાધ્યા સાથે હાજરી આપી હતી.
"
"Saiyami is the daughter of yesteryear actress Usha Kiran and niece of famous Bollywood actress Shabana Azmi.
","શબાના આઝમી પ્રસિદ્ધ શાયર કૈફી આઝમીની પુત્રી છે.
"
"A wife lost her husband, a mother lost her son, two brothers lost their brother, nephews and nieces lost their uncle and two girls lost their dad.
","કોઇક બહેને તેનો ભાઇ, કોઇક માતાએ દિકરો, કોઇક પત્નીએ પતિ તો કોઇક બાળકે પિતા ગુમાવ્યા હતા.
"
"Prime Minister Narendra Modi's niece Sonal Modi has sought a ticket from the ruling BJP in Gujarat to fight the upcoming civic body polls in Ahmedabad city.
","સોનલ મોદીએ અમદાવાદ શહેરમાં મહાનગરપાલિકાનું ઈલેક્શન લડવા માટે ગુજરાતમાં સત્તારુઢ ભાજપમાંથી ટિકિટ માંગી હતી.
"
"All with my wife, parents, siblings, aunt, cousins, nieces, and nephews.
","મારા સાસુ , સસરા , સાળો , તેની પત્ની , મારી બે સાળી , તેમના પતિ , બધાએ ભેગા મળીને ખૂબ જલસા કર્યા.
"
"Both are married and he has three nephews and two nieces.
","તેમને લગ્નસંબંધથી બે પુત્ર અને એક પુત્રી એમ ત્રણ સંતાનો છે.
"
"Also I have two nieces and a nephew.
","તેમજ મારે સંતાનમાં બે દિકરી તથા એક દિકરો છે.
"
"A daughter and niece.
","એક દીકરી અને દીકરો.
"
"Congratulations on your niece!
","ધન્ય છે તમારી જનેતાને!
"
"Sushant's sister Shweta Singh Kirti and niece Mallika Singh commented on Ankita's post.
","અંકિતા ઉપરાંત સુશાંતની બહેન શ્વેતા સિંહ કીર્તિએ પણ વધુ એક પોસ્ટ મૂકીને ભાઈને યાદ કર્યો છે.
"
"Where a newlywed bride recently fell in love with her niece.
","જ્યાં હાલમાં જ નવી નવી પરણીને આવેલી એક દુલ્હનને તેના ભાણેજ સાથે પ્રેમ થઈ ગયો હતો.
"
"Alia Bhatt is often seen hanging out with Ranbir Kapoor and his family including Samara who is his niece.
","આલિયા ભટ્ટ ઘણી વાર રણબીર કપૂરના પરિવાર સાથે જોવા મળે છે.
"
"Alia was seen making merry with Ranbir's family - mother Neetu Kapoor, father Rishi Kapoor, sister Riddhima Kapoor Sahni and niece Samiera Kapoor.
","રણવીર સાથે તેના પિતા ઋષિ કપૂર, મોમ નીતૂ કપૂર, બહેન રિદ્ધિમા કપૂર અને ભાણેજ સમારા કપૂર પણ હાજર રહી.
"
"Aly Goni expresses his desire to have a video call with his mother and to see his niece.
","જેમાં અલી ગોની પોતાની મમ્મીને વિડીયો કૉલ કરવાની અને બહેનના બાળકને જોવાની ઈચ્છા દર્શાવે છે.
"
"Nikunj, niece of Congress MLA from Sojitra constituency Punam Parmar, lost from the Tarapur seat of the district panchayat.
","સોજીત્રા કોંગ્રેસ ધારાસભ્ય પુનમભાઈ પરમારના દિકરો વિજય પરમાર તારાપુર તાલુકા પંચાયત ની મોરજ બેઠક ઉપરથી હાર્યા છે.
"
"Congrats on the birth of your niece!
","તમારા બાળકના જન્મ પર અભિનંદન!
"
"Kareena Kapoor Khan is in awe of her niece, Inaaya Naumi Kemmu.
","કરીના કપૂર તેના નણંદોયા કૃણાલ ખેમુ સાથે નજરે આવી રહી છે.
"
"Salman's birthday coincided with the birthday of his niece Ayat, daughter of Aayush Sharma and Arpita Khan.
","સલમાનની બહેન અર્પિતા ખાન શર્મા અને આયુષ શર્માએ દિકરા આહિલના બર્થડેનું ગ્રાંડ સેલિબ્રેશન કર્યુ હતું.
"
"And a new niece, too!
","અને, નવો જન્મ ધારણ કરે છે!
"
"Saba Ali Khan had shared a picture of her niece Sara Ali Khan on Instagram.
","સારા અલી ખાન (Sara Ali Khan)એ તેની ડાહપણની દાઢ કઢાવતો એક વીડિયો શેર કર્યો છે આ વીડિયોમાં તે હિન્દીમાં કમેન્ટ્રી કરતી નજર આવે છે.
"
