eng_Latn,tel_Telu
"Regarding Federico Chiesa's Family ancestry, there are no records of his maternal and paternal grandparents, while his uncles, aunts, nephews and nieces are largely unknown at the time of writing this biography.
","ఫెడెరికో చిసా యొక్క కుటుంబ వంశానికి సంబంధించి, అతని తల్లి మరియు తల్లితండ్రుల గురించి ఎటువంటి రికార్డులు లేవు, అయితే ఈ జీవిత చరిత్ర రాసే సమయంలో అతని మేనమామలు, అత్తమామలు, మేనల్లుళ్ళు మరియు మేనకోడళ్ళు ఎక్కువగా తెలియదు.
"
"Regarding the defender's extended family life and ancestry, not much is known about his maternal and paternal grandparents while his uncles, aunts, nephews and nieces are yet to be identified at the time of writing this biography.
","డిఫెండర్ యొక్క విస్తరించిన కుటుంబ జీవితం మరియు వంశపారంపర్యంగా, అతని మాతృ మరియు పితృ తాతల గురించి పెద్దగా తెలియదు, అయితే ఈ జీవిత చరిత్ర రాసే సమయంలో అతని మామలు, అత్తమామలు, మేనల్లుళ్ళు మరియు మేనకోడళ్ళు ఇంకా గుర్తించబడలేదు.
"
"Ring bearers are often nephews or young brothers (although they can also be nieces or sisters) and are generally in the same age range as flower girls, which is to say that they are no younger than about 5 nor older than 10.
","రింగ్ బేరర్లు తరచుగా మేనల్లుళ్ళు లేదా యువ సోదరులై ఉంటారు (వారు మేనకోడళ్ళు లేదా చెల్లెళ్ళు అయినా కావచ్చు) మరియు సాధారణంగా సుమ బాలలతో సమ వయస్కులై ఉంటారు, దానర్ధం వారు 5సంవత్సరాల కంటే తక్కువ వయసుతో గానీ 10సంవత్సరాల కంటే ఎక్కువ వయసుతో గానీ ఉండరు.
"
"She eventually went to the wonderful word of god and prayed about it and prayed and finally she got her answer and I now 2 nieces and a great god fearing brother-in-law !!
","చివరకు ఆమె దేవుని అద్భుతమైన పదం వెళ్లి దాని గురించి ప్రార్ధించినచో మరియు ప్రార్ధించినచో మరియు చివరకు ఆమె ఇప్పుడు ఆమె సమాధానం మరియు నేను వచ్చింది 2 మేనకోడళ్ళు మరియు ఒక గొప్ప దేవుడు సోదరుడు లో చట్టం fearing!
"
"She eventually went to the wonderful word of god and prayed about it and prayed and finally she got her answer and I now 2 nieces and a great god fearing brother-in-law!!
","చివరకు ఆమె దేవుని అద్భుతమైన పదం వెళ్లి దాని గురించి ప్రార్ధించినచో మరియు ప్రార్ధించినచో మరియు చివరకు ఆమె ఇప్పుడు ఆమె సమాధానం మరియు నేను వచ్చింది 2 మేనకోడళ్ళు మరియు ఒక గొప్ప దేవుడు సోదరుడు లో చట్టం fearing!
"
"She has been one of is own siblings, or she could have been a child of Abel or Seth, which will have made her a niece.
","ఆమె తన సోదరీమణులలో ఒకరిగా ఉండేది, లేదా ఆమె అబెల్ లేదా సేథ్ కుమార్తె అయి ఉండవచ్చు, ఆమె తన మేనకోడలను చేసింది.
"
"She has been one of is own siblings, or she has been a child of Abel or Seth, which may have made her a niece.
","ఆమె తన సోదరీమణులలో ఒకరిగా ఉండేది, లేదా ఆమె అబెల్ లేదా సేథ్ కుమార్తె అయి ఉండవచ్చు, ఆమె తన మేనకోడలను చేసింది.
"
"She has been one of is own true siblings, or she may have been a child of Abel or Seth, which might have made her a niece.
","ఆమె తన సోదరీమణులలో ఒకరిగా ఉండేది, లేదా ఆమె అబెల్ లేదా సేథ్ కుమార్తె అయి ఉండవచ్చు, ఆమె తన మేనకోడలను చేసింది.
"
"She hired assistants to care for her niece, and moved to Boston to be near her doctors.
","ఆమె తన మేనకోడలను చూసుకోవడానికి సహాయకులను నియమించుకుంది, ఆమె వైద్యులు సమీపంలో ఉండటానికి బోస్టన్కు వెళ్లారు.
"
"She is the niece of actress Padmini Kolhapure.
","చెల్లెలు పద్మిని కొల్హాపురి నటి.
"
"She might have been one of is own siblings, or she has been a child of Abel or Seth, which may have made her a niece.
","ఆమె తన సోదరీమణులలో ఒకరిగా ఉండేది, లేదా ఆమె అబెల్ లేదా సేథ్ కుమార్తె అయి ఉండవచ్చు, ఆమె తన మేనకోడలను చేసింది.
"
"She might have been one of is own siblings, or she has been a daughter of Abel or Seth, which will have made her a niece.
","ఆమె తన సోదరీమణులలో ఒకరిగా ఉండేది, లేదా ఆమె అబెల్ లేదా సేథ్ కుమార్తె అయి ఉండవచ్చు, ఆమె తన మేనకోడలను చేసింది.
"
"She might have been one of is own siblings, or she might have been a child of Abel or Seth, which may have made her a niece.
","ఆమె తన సోదరీమణులలో ఒకరిగా ఉండేది, లేదా ఆమె అబెల్ లేదా సేథ్ కుమార్తె అయి ఉండవచ్చు, ఆమె తన మేనకోడలను చేసింది.
"
"She might have been one of is own siblings, or she might have been a child of Abel or Seth, which will have made her a niece.
","ఆమె తన సోదరీమణులలో ఒకరిగా ఉండేది, లేదా ఆమె అబెల్ లేదా సేథ్ కుమార్తె అయి ఉండవచ్చు, ఆమె తన మేనకోడలను చేసింది.
"
"She might have been one of is own siblings, or she might have been a daughter of Abel or Seth, which may have made her a niece.
","ఆమె తన సోదరీమణులలో ఒకరిగా ఉండేది, లేదా ఆమె అబెల్ లేదా సేథ్ కుమార్తె అయి ఉండవచ్చు, ఆమె తన మేనకోడలను చేసింది.
"
"She talks with her niece on the phone every day.
","బావతో ప్రతి రోజూ ఆమె ఫోన్ లో మాట్లాడేది.
"
"She's been one of his real true siblings, or she could have been a daughter of Abel or Seth, which might have made her a niece.
","ఆమె తన సోదరీమణులలో ఒకరిగా ఉండేది, లేదా ఆమె అబెల్ లేదా సేథ్ కుమార్తె అయి ఉండవచ్చు, ఆమె తన మేనకోడలను చేసింది.
"
"She's got been one of is own true siblings, or she may have been a child of Abel or Seth, that might have made her a niece.
","ఆమె తన సోదరీమణులలో ఒకరిగా ఉండేది, లేదా ఆమె అబెల్ లేదా సేథ్ కుమార్తె అయి ఉండవచ్చు, ఆమె తన మేనకోడలను చేసింది.
"
"Similarly, Fernandes uncles, aunts, nephews and nieces have not been identified in notable events of his childhood story till date.
","అదేవిధంగా, ఫెర్నాండెజ్ పినతండ్రులు, అత్తమామలు, మేనళ్ళు మరియు మేనళ్ళు లను గుర్తించలేదు, ఇప్పటి వరకు అతని బాల్య కథలో గుర్తించదగిన ఘటనలలో గుర్తించబడలేదు.
"
"Similarly, not much is known about Zouma's uncles, aunts, nephews and nieces while his cousins have not been identified in notable events of his early life to date.
","అదేవిధంగా, జౌమా యొక్క మేనమామలు, అత్తమామలు, మేనల్లుళ్ళు మరియు మేనకోడళ్ళు గురించి పెద్దగా తెలియదు, అయితే అతని దాయాదులు అతని ప్రారంభ జీవితంలో గుర్తించదగిన సంఘటనలలో గుర్తించబడలేదు.
"
"Similarly, there are no records of Tielemans' uncles, aunts, nieces and nephews while his cousins have not been identified in notable events of his early life till date.
","అదేవిధంగా, టైలెమాన్ల పినతండ్రులు, అత్తమామలు, మేనళ్ళు మరియు మేనళ్లల రికార్డులు ఏవీ లేవు, అతని బంధువు తేదీ వరకు అతని ప్రారంభ జీవితం యొక్క గుర్తించదగిన సంఘటనలలో గుర్తించబడలేదు.
"
"Similarly, there are no records of Tielemans' uncles, aunts, nieces and nephews while his cousins have not been identified in notable events of his early life to date.
","అదేవిధంగా, టైలెమాన్ల పినతండ్రులు, అత్తమామలు, మేనళ్ళు మరియు మేనళ్లల రికార్డులు ఏవీ లేవు, అతని బంధువు తేదీ వరకు అతని ప్రారంభ జీవితం యొక్క గుర్తించదగిన సంఘటనలలో గుర్తించబడలేదు.
"
"Similarly, there are no records of his aunts, uncles, nieces and nephews while his cousins have not been identified in notable events of his early life till date.
","అదేవిధంగా, టైలెమాన్ల పినతండ్రులు, అత్తమామలు, మేనళ్ళు మరియు మేనళ్లల రికార్డులు ఏవీ లేవు, అతని బంధువు తేదీ వరకు అతని ప్రారంభ జీవితం యొక్క గుర్తించదగిన సంఘటనలలో గుర్తించబడలేదు.
"
"Similarly, there is not much about the forward's ancestry and family roots, particularly the identities of his maternal and paternal grandparents while his aunts, uncles, nephews and nieces are yet to be identified at the time of writing this bio.
","అదేవిధంగా, ఫార్వర్డ్ యొక్క వంశపారంపర్యత మరియు కుటుంబ మూలాల గురించి పెద్దగా తెలియదు, ముఖ్యంగా అతని తల్లి మరియు తల్లితండ్రుల గుర్తింపులు, అయితే ఈ బయో రాసే సమయంలో అతని అత్తమామలు, మేనమామలు, మేనల్లుళ్ళు మరియు మేనకోడళ్ళు ఇంకా గుర్తించబడలేదు.
"
"Similarly, there is not much known about Jones's family roots or ancestry, particularly his maternal and paternal grandparents while Jones Uncles, aunts, cousins, nephews and nieces are yet to be identified at the time of writing this biography.
","అదేవిధంగా, జోన్స్ కుటుంబ మూలాలు లేదా పూర్వీకుల గురించి పెద్దగా తెలియదు, ముఖ్యంగా అతని తల్లి మరియు తల్లితండ్రులు, జోన్స్ మామలు, అత్తమామలు, దాయాదులు, మేనల్లుళ్ళు మరియు మేనకోడళ్ళు ఈ జీవిత చరిత్ర రాసే సమయంలో ఇంకా గుర్తించబడలేదు.
"
"The first known interaction between the two provinces came in 640 A.D. , when the Tibetan King Songtsan Gampo married the Princess Wencheng, a niece of the Tang Emperor Taizong.
","ఈ రెండు రాష్ట్రాల్లోని మొట్టమొదటి పరస్పర సంబంధాలు 640 AD లో వచ్చాయి, టిబెటన్ కింగ్ సాంగ్త్సన్ కంబో టాంగ్ చక్రవర్తి టైజోంగ్ యొక్క మేనకోడలి ప్రిన్సెస్ వెన్చెంగ్ను వివాహం చేసుకున్నప్పుడు.
"
"The first known interaction between the two states came in 640 A.D., when the Tibetan King Songtsan Gampo married the Princess Wencheng, a niece of the Tang Emperor Taizong.
","ఈ రెండు రాష్ట్రాల్లోని మొట్టమొదటి పరస్పర సంబంధాలు 640 AD లో వచ్చాయి, టిబెటన్ కింగ్ సాంగ్త్సన్ కంబో టాంగ్ చక్రవర్తి టైజోంగ్ యొక్క మేనకోడలి ప్రిన్సెస్ వెన్చెంగ్ను వివాహం చేసుకున్నప్పుడు.
"
"The incident occurred after Vikram Joshi had filed a complaint in the local police station a week ago against people who were harassing his niece.
","తన మేనకోడలిని కొందరు వ్యక్తులు వేధిస్తున్నారంటూ విక్రమ్ జోషి విజయ్నగర్ పోలీస్స్టేషన్లో ఫిర్యాదు చేసిన కొద్ది రోజుల తర్వాత సోమవారం ఈ ఘటన చోటు చేసుకుంది.
"
"The incident occurred on Monday, days after Joshi had filed a complaint with Vijay Nagar Police Station stating that some men were harassing his niece.
","తన మేనకోడలిని కొందరు వ్యక్తులు వేధిస్తున్నారంటూ విక్రమ్ జోషి విజయ్నగర్ పోలీస్స్టేషన్లో ఫిర్యాదు చేసిన కొద్ది రోజుల తర్వాత సోమవారం ఈ ఘటన చోటు చేసుకుంది.
"
"The incident occurred on Monday, days after Vikram Joshi had filed a complaint with Vijay Nagar Police Station stating that some men were harassing his niece.
","తన మేనకోడలిని కొందరు వ్యక్తులు వేధిస్తున్నారంటూ విక్రమ్ జోషి విజయ్నగర్ పోలీస్స్టేషన్లో ఫిర్యాదు చేసిన కొద్ది రోజుల తర్వాత సోమవారం ఈ ఘటన చోటు చేసుకుంది.
"
"The incident occurred on Monday, days after journalist Joshi had filed a complaint with Vijay Nagar Police Station, stating that some men were harassing his niece.
","తన మేనకోడలిని కొందరు వ్యక్తులు వేధిస్తున్నారంటూ విక్రమ్ జోషి విజయ్నగర్ పోలీస్స్టేషన్లో ఫిర్యాదు చేసిన కొద్ది రోజుల తర్వాత సోమవారం ఈ ఘటన చోటు చేసుకుంది.
"
"The most important people in my life are my mom and dad, my sister and my niece.
","నా వ్యక్తిత్వానికి ప్రధాన వ్యక్తులు అమ్మమ్మ, మేనత్త, అమ్మా నాన్నగార్లు.
"
"The sad thing is, she is my mother, my sisters, my aunts, and my nieces.
","విచారకరమైన విషయం ఏమిటంటే, ఆమె నా తల్లి, నా సోదరీమణులు, నా అత్తమామలు మరియు నా మేనకోడళ్ళు.
"
"This includes grandchildren who are old enough for the responsibility, cousins, nieces, nephews, and members of an organization that was dear to the person's heart.
","ఈ బాధ్యత, దాయాదులు, మేనళ్ళు, మేనల్లుళ్ళు మరియు వ్యక్తి యొక్క హృదయం ప్రియమైన ఒక సంస్థ యొక్క సభ్యులకు తగినంత వయస్సు ఉన్న మనుమడులను కలిగి ఉన్నారు.
"
"This list of extended Chinese family relationships covers family members of the same generation or younger - cousins, bothers and sisters-in-law, and nieces and nephews.
","విస్తరించిన చైనీస్ కుటుంబం సంబంధాల ఈ జాబితా అదే తరం లేదా యువ - దాయాదులు, ఇబ్బందులు మరియు సోదరీమణులు, మరియు మేనళ్ళు మరియు మేనల్లుళ్ళు యొక్క కుటుంబ సభ్యులను వర్తిస్తుంది.
"
"This time, it's my niece!
","ఈసారి కొంటెనవ్వు నాది!
"
"^ In 1902, he met his future wife Eleanor Roosevelt , Theodore's niece, at a White House reception (they had previously met as children, but this was their first serious encounter).
","1902లో ఆయన భవిష్యత్ భార్య, థియోడోర్ సోదరుని కుమార్తె ఎలియనోర్ రూజ్వెల్ట్ను ఒక వైట్హోస్ కార్యక్రమంలో కలుసుకున్నారు, (బాల్యంలో కూడా వీరు కలుసుకున్నప్పటికీ, వీరిద్దరికి ఇది మొదటి ముఖ్యమైన కలయిక).
"
"Based on the deceased woman’s niece Richa, police registered a case of murder under Section 302 of the Indian Penal Code (IPC).
","భారతీయ శిక్షాస్మృతి (ఐపిసి) సెక్షన్ 302 (హత్య) కింద మహిళపై పోలీసులు కేసు నమోదు చేశారు.
"
"US Vice President Kamala Harris's niece Meena Harris also showed her support.
","ఇక అమెరికా ఉపాధ్యక్షురాలు కమలా హారీస్‌ బంధువు మీనా హారీస్ కూడా దిశా అరెస్ట్‌ను ఖండించారు.
"
"Veronica is the daughter of YS Sudheekar Reddy and niece of late Chief Minister YS Rajasekhar Reddy.
","రాజశేఖర్ రెడ్డి తమ్మడైన సుధీకర్ రెడ్డి కూతురు విరానిక రెడ్డి.
"
"KCR is Chief Minister, his son and nephew are Ministers, his daughter is Lok Sabha member and his niece is Rajya Sabha member,” she said.
","కేసీఆర్‌‌ సీఎం అయ్యారని. . కొడుకు, అల్లుడు మంత్రులు, బిడ్డ ఎంపీ అయ్యారన్నారు.
"
"Aamir Khan along with his wife Kiran Rao, son Azad Rao Khan and daughter Ira Khan attended his niece Zayn. . . . .
","ఈ కార్యక్రమానికి అమీర్ ఖాన్ భార్య కిరణ్ రావు తన కుమారుడు ఆజాద్ రావ్ ఖాన్ తో వచ్చింది.
"
"Jayalalithaa’s bungalow to be handed over to her niece and nephew, rules Madras High Court
","జయలలిత నివాసాన్ని ఆమె మేనకోడలికి అప్పగించండి: మద్రాస్ హైకోర్టు కీలక తీర్పు
"
"Their list included relatives of Sasikala's nephew Vivek Jayaraman - the chief of Jaya TV - her niece Krishnapriya, her brother Dhivakaran, husband Jayaraman and nephew TTV Dhinakaran, the sidelined AIADMK leader currently fighting for control of the party.
","శశికళ సోదరుడు దివాకరన్, టీటీవీ దినకరన్, టీటీవీ భాస్కరన్, జయా టీవీ ఎండీ వివేక్, క్రిష్ణప్రియ ఎవరికి వారు తామే జయలలిత, శశికళ వారసులు అంటూ ప్రకటించుకోవడం వారి కుటుంబ సభ్యుల్లో చిచ్చురేపింది.
"
"Niharika, niece of Megastar Chiranjeevi and daughter of actor-producer Naga Babu, got engaged to Chaitanya on August 13 at a plush hotel in Hyderabad.
","కాగా ఆగష్టు 13న మెగా బ్రదర్ నాగబాబు కూతురు నిహారిక నిశ్చితార్ధం హైదరాబాద్‌లోని ట్రైడెంట్ హోట‌ల్‌లో జరిగిన విషయం తెలిసిందే.
"
"Justice N Seshasayee passed the order on writ petitions filed by Jayalalithaa’s niece and nephew, J Deepa and J Deepak, against the acquisition.
","రాష్ట్ర ప్రభుత్వ నిర్ణయాన్ని సవాలు చేస్తూ జయలలిత మేన కోడలు దీప, మేనల్లుడు దీపక్‌ వేసిన రిట్‌ పిటిషన్‌పై జస్టిస్‌ ఎన్‌ శేషసాయి నేతృత్వంలోని ధర్మాసనం ఈ మేరకు తీర్పు చెప్పింది.
"
"Salman has also expressed his joy over the birth of his niece.
","మేనల్లుడు పుట్టినందుకు సల్మాన్ సంతోషంలో మునిగిపోయాడు.
"
"Vikram Joshi's brother Aniket Joshi said the UP journalist had recently submitted a written complaint in Vijay Nagar police station in which he alleged that some men had misbehaved with his niece.
","దీనిపై విక్రమ్ జోషి సోదరుడు అనికేట్ జోషి మాట్లాడుతూ. . తన సోదరుడు ఇటీవల విజయ్ నగర్ పోలీస్ స్టేషన్లో లిఖితపూర్వక ఫిర్యాదును సమర్పించారని, ఇందులో కొంతమంది అబ్బాయిలు తన మేనకోడలితో అసభ్యంగా ప్రవర్తించారని ఆరోపించారు.
"
"He married his wife's niece.
","అతనికి మేనమామ కూతురుతో వివాహమైంది.
"
"Aunts, Uncles, cousins, brothers, sisters, and nieces were there.
","తాతయ్యలు, అక్కలు, బావలు, అన్నలు, వదినెలు , బాబాయలు, పిన్నులు ఇలా ఎంతో మంది ఉండేవారు.
"
"A couple of days ago, star Tollywood director Rajamouli’s son Karthikeya got engaged to Pooja Prasad, niece of senior hero Jagapathi Babu.
","ప్రముఖ దర్శకుడు రాజమౌళి తనయుడు కార్తికేయ, జగపతిబాబు సోదరుని కుమార్తె పూజా ప్రసాద్‌ వివాహం రాజస్థాన్‌లో బాలీవుడ్‌ టు టాలీవుడ్‌ సినీ ప్రముఖులు మధ్య ఘనంగా జరిగిన సంగతి తెలిసిందే.
"
